B,I,N,G,O
Tiki hut at Indochine,Merritt's Burger House,Dixie Grill,Henry's Restaurant & Bar,Salt Works
Elizabeth's Pizza,Catch,Bluewater,Nicola's Italian Restaurant,Burger at Winnie's  Tavern
Goody Goody Omelet House,Copper Penny,Cape Fear Seafood Company,Oceanic Restaurant,Casey's Buffet
Little Dipper Fondue,Brasserie Du Soleil,Elijah's,Osteria Cicchetti,Bridge Tender
Caprice Bistro,Sweet N Savory Cafe,Freddie's Restaurant,RuckerJohn's,K-38 Baja Grill
Chop's Deli,Port City Chop House,Port Land Grille,Le Catalan,YoSake
22 North,Circa 1922,Deckhouse,Breakfast at Causeway Cafe,Trolly Stop
Black Sea Grill,Flaming Amy's Burrito Barn,Jester's Cafe,Pilot House,Thai Peppers
Boca Bay,Front Street Brewery,Jimbo's Breakfast & Lunch,Sahara Pitas and Subs,The Basics
Brooklyn Pizza,Hieronymous Seafood Restaurant,Michael's Seafood Restaurant,South Beach Grill,White Front Breakfast House
Dockside,Jackson's Big Oak Barbecue,Nikki's Sushi,Szechuan 132,Double Happiness Chinese Restaurant
Chris's Restaurant,Jerry's Food Wine & Spirits,Paddy's Hollow,Terrazzo Trattoria,Eddie Romanelli's
Aubriana's,Bon Appetit,The German Cafe,Kornerstone Bistro,Private balcony at Riverboat Landing
The Bento Box,East at Blockade Runner,Giorgio's Italian Restaurant,Manna,Ruth's Kitchen
Big Thai II,Fish Bites Seafood Restaurant,J. Michael's Philly Deli,Olympia Restaurant,San Juan Cafe
Boathouse Restaurant,Fish House at Blue Water Point Motel,Joseph's Italian Bistro,Pender's Cafe,The Sawmill Restaurant
Something Fishy Seafood,Taylor Cuisine Cafe,King Neptune,PT's Olde Fashoioned Grille,Siena Trattoria
Sub Stop,Tazy's Burgers & Grill,Thai Spice,Trolly Stop,Yacht Basin Provision Co.
Tandoori Bites,Temptations Everyday Gourmet,The Bento Box,Wasabi Sushi,Mr. P's Bistro
Port City Brew Bus tours,Calabash-style seafood in Calabash,The George,Meatball Tuesday at Little Pond Catering,Ocean Grill's Tiki Bar
South Beach Grill,Oceans at Holiday Inn Resort,Joe's Oasis,Ida Thai,Angelo's Italian
